{
    "id":  "default",
    "name":  "Emerald Frontier",
    "description":  "Fixed handcrafted 30x30 map with clustered biomes and scenic routes.",
    "thumbnail_key":  "map_default",
    "legend":  [
                   {
                       "id":  "road",
                       "name":  "Road",
                       "icon_key":  "marker_road"
                   },
                   {
                       "id":  "resource_point",
                       "name":  "Resource Point",
                       "icon_key":  "marker_resource"
                   },
                   {
                       "id":  "safe_zone",
                       "name":  "Safe Zone",
                       "icon_key":  "marker_safe_zone"
                   }
               ]
}
